institution_name,institution_type,parent_organization,leadership,institution_country,institution_city,research_diseases,research_fields,key_technologies,key_achievements,international_collaboration,funding_sources,technology_application,id
Institut Pasteur,,,,,,Leptospirosis,microbiology||epidemiology,leptospiral identification methods||gene amplification,identification of several virulence factors in Leptospira,FAO/WHO Collaborating Center for Epidemiology of Leptospirosis,,,449754
Desert Springs Hospital,,,"Arjun Gururaj, MD, FACC||Chris Loftus",USA,,Irregular Heart Rhythm||Atrial Fibrillation,clinical_research,non-fluoroscopic catheter ablation||ultrasound guidance||3D mapping,first non-fluoroscopic AFib ablation filmed in the U.S.,,,non-fluoroscopic catheter ablation for AFib patients,343387
Walter and Eliza Hall Institute of Medical Research,public,,David Vaux || Suzanne Cory || Jerry Adams || David Huang || Andrew Roberts || Julian Clark,Australia,Melbourne,chronic lymphocytic leukemia,oncology,BH3-mimetic drug || Bcl-2 inhibition,discovery of Bcl-2 role in leukemia cell survival || development of ABT-199,Abbott || Genentech || Cancer Trials Australia,,clinical trial for CLL,92851
Naval Medical Research Center||Uniformed Services University of the Health Sciences||Aplix Research Inc,public||university-affiliated||private,Uniformed Services University of the Health Sciences,,USA,Silver Spring||Gaithersburg,Bartonellosis,microbiology||clinical_research||molecular_biology,quantitative PCR||genome sequence analysis,developed a highly sensitive qPCR assay for Bartonella bacilliformis,,government grant,detection of Bartonella bacilliformis in clinical and vector samples,557506
Yale Center for Reproductive Biology,university-affiliated,Yale University,"Hugh S. Taylor, MD",USA,New Haven,endometriosis,clinical_research,,,,,,443870
"South West Sydney Limb Preservation and Wound Research Academic Unit || High-Risk Foot Service, Liverpool Hospital || Medical and Podiatry School, University of Pisa || Institute for Wound Research, University of Florida || Monash Institute for Health and Clinical Education, Monash University || Austin Repatriation Hospital",university-affiliated || public,Western Sydney University || University of Pisa || University of Florida || Monash University,Matthew (Director of Research) || Professor Alberto Piaggesi || Professor Greg Schultz || Associate Professor Geoff Sussman || Nikki Frescos,Australia || Italy || USA,Sydney || Pisa || Gainesville,diabetic foot || diabetes related foot wounds || lower limb complications of diabetes || diabetic foot infections,clinical_research || microbiology || pathology,molecular techniques || microscopy techniques,member of the International Working Group for the Diabetic Foot (IWGDF) diabetic foot infection guidelines working group || founder of the Association of Diabetic Foot Surgeons (ADFS) || scientific responsible and organiser of the Italian and the International residential course on the management on lower limb complications of diabetes,International Working Group for the Diabetic Foot (IWGDF) || European Wound Management Association (EWMA),,,237337
Relevium||NUIG||HiTech Health,,,Dr. Alison Liddy,Ireland,Galway,osteoarthritis of the knee,,hydrogel-based painkiller,preclinical testing of Hydrobloc,,government grant,pain relief and joint lubrication for six months,387831
Chaim Sheba Medical Center,public,,Arnon Nagler,Israel,Ramat Gan,Acute Graft versus Host Disease,immunology||oncology,,,,,,459457
Imperial College Healthcare NHS trust || Imperial College London || St Mary's hospital || Imperial Weight Centre || Imperial Centre for Patient Safety and Service Quality (CPSSQ),public || university-affiliated,Imperial College London,Mr Krishna Moorthy,UK,London,hiatus hernia || gastro-oesophageal reflux disease || oesophageal achalasia || cancers of the stomach || cancers of the oesophagus || obesity,clinical_research || surgery,laparoscopic surgery || single incision surgery || simulation for surgical training,development of the WHO surgical checklist,,,surgical skills training programmes || patient safety training,475424
VUmc||VU Medical Center,university-affiliated,,Prof. Dr. Guus van Dongen,Netherlands,Amsterdam,head and neck cancer,oncology||medical_imaging,immuno-PET||TKI-PET||photoimmunodetection||radiolabeled monoclonal antibodies||Zirconium-89 labeling,more than 20 antibody conjugates into first-in-man studies,University Medical Center Groningen||St. Radboud Medical Center Nijmegen||University Hospitals Brussels||University Hospitals Antwerp||EATRIS,,first-in-man studies of antibody conjugates,293152
Centre de Recherches Médicales de Lambaréné (CERMEL),,,Dr. Ghyslain Mombo-Ngoma,Gabon,Lambaréné,malaria||HIV/AIDS||filariasis||schistosomiasis||onchocerciasis,epidemiology||clinical_research||public_health,,,ISGlobal||Medical University of Vienna||BNITM Hamburg||AMC Amsterdam||University of Tübingen||Novartis||Merck||CISM Manhiça||MMV,international grant,clinical trials for malaria control||treatment regimens for filarial diseases including onchocerciasis,677986
"Fondazione IRCCS Ca' Granda, Ospedale Maggiore Policlinico || CSL Behring",,,Elena Santagostino,Italy || USA,Milan || King of Prussia,Hemophilia B,clinical_research,recombinant coagulation factor IX with recombinant albumin (rIX-FP),prolonged dosing intervals of up to 14 days with rIX-FP for routine prophylaxis,"Fondazione IRCCS Ca' Granda, Ospedale Maggiore Policlinico || CSL Behring",,routine prophylaxis in previously-treated people with hemophilia B,21790
Revlon/UCLA Breast Center,university-affiliated,UCLA,,USA,Los Angeles,Advanced Breast Cancer,oncology||clinical_research,chemotherapy,,,,neoadjuvant treatment,51178
"Division of Otorhinolaryngology, Department of Surgery, Queen Mary Hospital, University of Hong Kong Medical Center",university-affiliated,University of Hong Kong Medical Center,Lawrence C.K. Chow||Y. Hui||Dennis K.K. Au,China,Hong Kong,Neurosarcoidosis,clinical_research||pathology,audiogram||transient evoked otoacoustic emissions (TEOAEs)||distortion product otoacoustic emissions (DPOAEs)||auditory brainstem response (ABR)||magnetic resonance imaging (MRI)||serologic testing||histopathology,,,,diagnosis of sarcoid-induced hearing loss,181651
Johns Hopkins' Stiff Person Syndrome Center,public||university-affiliated,Johns Hopkins Medicine,,USA,,Stiff Person Syndrome,clinical_research||neuroscience,clinical database||whole body FDG-PET/CT||neurophysiological studies (EMG),maintains a huge database of clinical findings and outcomes,,,,529557
Microbiome Research Centre||MRC,university-affiliated,UNSW Sydney,Professor Emad El-Omar||Professor Michael Grimm||Professor Georgina Hold,Australia,Sydney,inflammatory bowel disease||gastrointestinal cancer||Helicobacter pylori infection,microbiology||immunology||bioinformatics||clinical_research,bioinformatics algorithms||multi-omic technologies,Crohn__ and Colitis Australia scholarship,Fulbright Scholarship||Harvard School of Public Health,,IBD clinic that uses biologic therapy,223208
Emory University,university-affiliated,Emory University,,USA,Atlanta,vestibular neuritis||Meniere's disease||benign paroxysmal positional vertigo (BPPV)||dizziness||vertigo||balance disorders,neuroscience||clinical_research,,,,,,651189
Massachusetts Institute of Technology (MIT),university-affiliated,,,USA,,Lyme disease,clinical_research||medical_imaging,RightEye vision system||eye tracking technology,,RightEye,,,462795
Epidemiology and Public Health (EPH) group||School of Community Health Sciences||University of Nottingham,university-affiliated,University of Nottingham,Richard Logan||Joe West,UK,Nottingham,coeliac disease||inflammatory bowel disease||gastrointestinal infection,epidemiology||clinical_research||public_health,large database analysis||systematic reviews||meta-analysis||randomised controlled trials,quantified mortality risk in coeliac disease||demonstrated 1% prevalence of coeliac disease in the UK||shown malignancy risk in coeliac disease is far lower than previously thought||identified 50-60% reduction in breast cancer risk in coeliac disease,,government grant||other,,257278
National Cancer Institute (NCI),public,National Institutes of Health (NIH),John Niederhuber||John Weinstein,USA,,cancer||stomach cancer,genomics||oncology||bioinformatics,molecular profiling||microarray analysis,NCI-60 cancer cell line panel||discovery of ASNS as biomarker,,,personalized anticancer strategies,543709
University of Kansas Cancer Center,public||university-affiliated,University of Kansas,"Abdulraheem Yacoub, MD||Roy Jensen, MD",USA,Kansas City,essential thrombocytosis||polycythemia vera||primary myelofibrosis||chronic myeloid leukemia||systemic mastocytosis||myeloproliferative neoplasms,oncology||clinical_research,clinical trials||stem cell transplant,founding member of MPN Research Consortium||clinical trial options for every patient,MPN Research Consortium,government grant,clinical trial participation for MPN patients||stem cell transplant for curative therapy,121919
Metropolia University of Applied Sciences||Koite Health||University of Helsinki,university-affiliated||private,,Timo Sorsa||Tommi Pätilä||Sakari Nikinmaa,Finland,Helsinki,Gingivitis||Periodontitis,clinical_research||microbiology,Lumoral device||antibacterial photodynamic treatment (aPDT)||antibacterial blue light (aBL),Significant reduction of gingivitis in clinical study,,,At-home dental hygiene improvement for gingivitis and periodontitis,97322
Dana-Farber/Boston Children's Cancer and Blood Disorders Center,,,,,,Chronic Granulomatous Disease (CGD),clinical_research,gene therapy,,,,gene therapy clinical trial for CGD,597779
Longevity Complementary Care Center,,,Dr. Marnae Ergil,USA,Macedon,eczema,,Chinese herbal medicine,,,,,472966
Medical University of South Carolina,university-affiliated,,Dr. Eyad Almallouhi,USA,Charleston,Serotonin Syndrome,clinical_research||neuroscience,Electroencephalogram (EEG)||Magnetic Resonance Imaging (MRI),First case to report new onset focal clinical seizures with evidence of focal abnormality on EEG in the setting of serotonin syndrome,,,,142179
"Cardiovascular Centre of the University of Lisbon (CCUL)||Lisbon School of Medicine, Universidade de Lisboa||Santa Maria University Hospital _ CHULN EPE||Nuclear Medicine Institute of Lisbon School of Medicine||Centro Hospitalar Universitário Lisboa Norte",university-affiliated,Universidade de Lisboa,"Azevedo Coutinho, Conceição, MD PhD||Cantinho, Guilhermina, MD||Conceição, Isabel, MD",Portugal,Lisbon,Familial Amyloid Polyneuropathy (FAP)||cardiac TTR amyloidosis||Transthyretin V30M (TTR-V30M) amyloidosis,clinical_research||medical_imaging||neuroscience,"99mTc-3,3-diphosphono-1,2-propanodicarboxylic acid (DPD) scintigraphy||cardiac ultrasound tests (2D, M Mode, Doppler, Tissue Doppler, Strain and Strain Rate Imaging, Speckle tracking, 4D)||Nuclear Cardiology",Largest cohort data on TTR-V30M amyloidosis||Best Cardiology Work award competitor||International award of the American Society of Nuclear Cardiology Congress,Columbia University College of Physicians and Surgeons||Columbia Presbyterian Medical Center,philanthropy,early diagnosis of cardiac TTR amyloidosis using DPD scintigraphy,440594
Baystate Children__ Hospital Pediatric Sleep Medicine Program||Baystate Regional Sleep Program,,Baystate Health,,,,nightmares||night terrors||bedwetting||insomnia||obstructive sleep apnea,clinical_research,sleep study||polysomnogram,"only facility in the western Massachusetts region to offer hospital-based, pediatric sleep studies||only one to offer sleep studies for babies and children under age three",,,diagnosis and treatment of pediatric sleep problems,645029
AHN Institute for Pain Medicine,public,Allegheny Health Network,"Jack Kabazie, MD || Till J. Conermann, MD",USA,Pittsburgh,Opioid Use Disorder || chronic pain,clinical_research || public_health,,,,industry grant,Enhanced Pain Management Program,568631